tweet_text,cyberbullying_type
muslims figured out slavery way before you white people we would buy slaves and set them free and give them equal chances in a world where white people made it alright to own black slaves our religion and government had it figured out years ago educate yourself idiot,religion
hoje adolescentes vão tirar suas próprias vidas devido ao bullying › reblog se você se importa › ›,not_cyberbullying
anything that requires a government id is a privacy concern anything that requires money is a bad idea forever,other_cyberbullying
can’t wait to tell my kids that i met their dad in school but he used to bully me,age
nigger fuck you u prick fuck yoh dumb ass,ethnicity
so just to save you all some time bsd is my family the only negative response gg ever received was from a nondev,not_cyberbullying
isn’t this just the prettiest ⁣ ⁣ preorder alert ⁣ ⁣ devious kisses the first steamy bully romance standalone in an allnew series it’s just high school is now up for preorder⁣ ⁣ devious kisses by…,age
“ im drunk ass fuck you dumb nigger faggot” you drew,ethnicity
lmao dumb ass bitches fuck that i wanna beat their ass,ethnicity
i went through a lot of this growing up so i can understand the feeling even from people who knew me in school and college but who couldnt at least voice their issues in person instead such people chose to hide behind a screen and bully me online,age
misha collins makes rape jokes and uses the word gay as an insult misha cancelled,gender
roflmao,not_cyberbullying
its not internet rules its the way the code is written,other_cyberbullying
you dumb ugly fuck nigger name wayne positive trash soft ass nigga pictwittercombzjqndm,ethnicity
tasek gelugor mp shabudin is sick and bloody idiot,other_cyberbullying
don’t take the baitreach out to all colored it’s going to take that to move forwardracism is engineered bye those we never see it’s not the common manits used like a weapon divide and conquer don’t take the baitthis place in time needs u to rise above,ethnicity
im being bullied,other_cyberbullying
they cant say fuck but they can say nigger boondocs this shit is sooo dumb,ethnicity
so she can try amp claim innocence but statistics paint her as being someone to avoid and ive been in her sights for a while oh well,not_cyberbullying
bully beatdown o,not_cyberbullying
you offend one high school bully and here come all her friends pack it up dance team,age
disgusting this baton rouge judge mike erwin openly called a black woman a nigger at a local restaurant,ethnicity
i dont care what someone else thinks one has to be an idiot of highest order to treat those who consider themselves as muslims as hindus those muslims must be laughing at our stupidity now your turn do you prefer them over other hindus,religion
im more scared of rd wave feminazi fascists mad max isnt in charge of educating uni students and girl guides,gender
cant you see dumb ugly fuck name wayne ugly black trash nigger name wayne off my pussy off my complexion pictwittercomrnkqxumezt,ethnicity
rt just not very appealing to me then again it is a tv show that revolves around women in prison probably why i dont like…,gender
sighs softly and gets up again was that so hard sit down ill help you treat them nods at the chair,not_cyberbullying
fyi im black there is a thing for white culture called the magical negro white people love the idea that there is an unusually talented or gifted black person who saves the day this has pretty much been about the only type of film with aas in it that gets academy awards,ethnicity
,other_cyberbullying
what the hell were annie and lloyd thinking badchoicesa mkr kat might get their wish of going up against her,not_cyberbullying
i don’t let anyone else call any female i’m with a bitch so why would i use it to describe the mother of my child,gender
fuck ass nigger can not even spell right we do not want jessica to be the homie of a dumb ass now do we,ethnicity
too bad and too desperate to realize there is no muslim ban joe i think you better rethink your policy proposals because at the moment you sound like an idiot,religion
fuck obama dumb ass nigger i guess ignorance is bliss,ethnicity
whered u go in mtown homie i know a couple of the schools from going to tsu,not_cyberbullying
if you dont have an answer you are just being a sanctimonious complainer,not_cyberbullying
i am not sure if enabling twitter from within wow is a good idea or not,other_cyberbullying
in other words “them” is close to a modern day isis the quran permits killing terrorists in selfdefence because they have waged preemptive war against you or against christians jews or people of any faith,religion
for the first time in my months of monitoring this a man momentarily surpassed all the lws in targeted gamergate harassment congrats,other_cyberbullying
video kevin durant gets flushed on by geoff aka big bully at dyckman via,not_cyberbullying
the illuminati even has a branch called the gay mob they will rape and kill you if you deny them no joke look them up,gender
all these girls’ high girls going hard for jill but i heard she hated ghs because she got bullied lol i mean i still love me a girls high girl now,age
racism is bad and there are so many alternatives lipsticks but u choose to support someone who degrades ethnic groups the world is meant for everyone and everyone needs to be respected u like a person who has no respect for people and if u were born a different skin colored,ethnicity
lol i dont think ive ever hear a lamer rationalization in my life that kind of lying gets you blocked,not_cyberbullying
slept then too,other_cyberbullying
well my manager certainly did not agree and neither did the girls in high school who bullied me mercilessly about it,age
the japanese army was a nationalist group not a religious terror group,not_cyberbullying
mileycyrus miley cyrus shocks fans with daterape joke during gig at gay in london,gender
i havent seen jews go on killing rampage against holocaust deniers violence is islams answer to everything,religion
something is deeply wrong with him that and the lying scare the hell out of me,not_cyberbullying
your sense of moral superiority would be laughable if not so damaging to our children do you even know you are as much of a racist as some idiot who speaks against blacks or indians or muslims thats not hate it is the plain truth something you may not recognize,religion
,other_cyberbullying
everyone tryin to be a “cute alt girl” like they didn’t bully us through middle and high school,age
dam my schedule is da mad full lol got mad ppl to see n things to do,not_cyberbullying
if you are a leftist you support nba nike democrats biden who are bought off by china who has gulags of muslims organ trafficking forced muslim female uighur marriages to ethnic non muslim han chinese how crazy are they and they support pedos too usefulidiots,religion
i hate how you niggers keep saying brown skin girl is only for dark skin people shut up please hard r because y’all are acting ignorant as fuck you all sound dumb,ethnicity
need skype verification for keybaseio,other_cyberbullying
as late as some of my friends and i were calling each other na as a term of endearment i also called stuff gay and used the word fggot a lot made rape jokes and sexist jokes i thought it was all fine bc i knew i didnt actually hate black pplgay peoplewomen etc,gender
here again,not_cyberbullying
oh btw i met the girl who bullied me again back in high school we were even classmates lmaooo idk if it was just me or what but she still looked at me like she was still disgusted at me but im cool tho we were just yrs old but still kinda sad looking at who ive become,age
i knew i shouldve stayed home,not_cyberbullying
yo nigger evolution fuck why u making fun of scarce when ur uglier then him for fucks sake ur a dumb monkey go to the zoo,ethnicity
❤️❤️😊,other_cyberbullying
why uscirf is biased and blindfolded by the islamic terrorism what right they have to interfere with national security by supporting traitors,religion
confronting the primary school bully and then breaking his arm with my pencilcase,age
hey twitter armys whoever is good at hacking can you do it for me so i have this girl in my class who is an army too but she bullies me for liking bts and she stole my first ever group friend and now i am all alone but this was in a new school my old school i had friends,age
frankie boyle talks people put money in gave him a couple of gags a rape jokeamp one about gay men having sex with their mum blimey danny devito likes plenty of butter on his crumpet joan rivers escaped getting in the crosshairs good girls go to hell stuck a fork in you,gender
impeached trump is not invincible we beat him now he thinks masks are “patriotic” we beat him he cancelled convention we beat him amp now he stopped his bullying on opening schools we put the “bully” in check we’ll boot the bully out of,age
ive been prescribed adderall for years,other_cyberbullying
you would love my desktop p its in the fantastically ugly case designed by bmw thermaltake,other_cyberbullying
ahemas a pens fan i can appreciate a system that rewards a well executed rebuild souh yeah,other_cyberbullying
right simply because she’s a southern baptist christian woman such a hypocrite that’s why she and l t like each other a lot,religion
i would even be willing to live outside the city for that house,other_cyberbullying
calling players black cunts and niggers is fucking disgusting when you have black people playing in your own team,ethnicity
rt really wish the melbourne girls reacted like chef casper to that fondant critique mkr,not_cyberbullying
even if you arent an outsider youre not welcome here if you berate people for their interests either stop acting like a high school bully or go to your little time out corner,age
rt why starbucks spells your name wrong,not_cyberbullying
rt and i are safe we are outside hiding behind the concrete officer is bleeding badly but im not posting unedit…,other_cyberbullying
again talking about feminists not you man,gender
a liar is a liar christian womanright,religion
facebook,other_cyberbullying
nigga rt i fuck your bitch in your house and i cum on your side of the bed bitch ass punk ass dumb ass basic ass nigger,ethnicity
i you wish i can send you many similar pics from your army who were living in hell and went straight thereif you were capable of ruling hindustan than it was not ruled by muslims for years idiot,religion
and really i like who im becomin,not_cyberbullying
you sad little cracker rt fuck obama dumb ass nigger,ethnicity
anybody want to join me on an adventure i need to get away for a semester im thinking georgia thcollege yolo,not_cyberbullying
el bullying no es nuevo asi es como uno aprende a defenderse dejen de criar niños lelos suficiente tienen con lo que ven en la tv,not_cyberbullying
go fuck yourself you dumb fucking nigger i fucking hate you just you wait bitch just you wait ill get you fat fuck,ethnicity
my real name is universal i got called as male pronouns more than as a female but i give no fuck at all at least you dont call me a bitch when were strangers than its good for me,gender
if u cant vote thats ok they are just showing others that this is what i do i hope u can help vote to no one is saying to prioritize voting over ur well being because u should take care of urself first i hope everyone understands each others perspective and show respect,ethnicity
rt and no im not sexist women are to be treated as any other person on this planet,gender
so u can kiss our diverse unified multicolored behinds bc your racism amp your terrorism will not win the day,ethnicity
aye yall get her ass rt fuck obama dumb ass nigger,ethnicity
lol hahah that one easy can bully,not_cyberbullying
yes osama bin laden was also struggling for truth that how america is so rich bagdadi was struggling for truth that how world believe in humanity muslim like u is shield for terrorist that is only jihad ting se le ke tong ting se le ke tong,religion
i would but my time is super limited these next few days im about to have to run too many meetings,other_cyberbullying
strip clubs open public schools closed maybe strippers need to unionize,age
— first impression u seem nice — a nickname id give you idk — emoji that fits you im sorry i cant think of one — do i like you yeah — you’re my mutual — to be honest we’ve never interacted before but i’ve seen u on my tl ur cool — have i ever disliked you nope,ethnicity
this made me so mad like this is something my secondary school bully would say,age
mever trust girls with a crackpipe leasing flat over a state of bullied high cons when they say ohhh ya face looks like my grandmother,age
shittygamertakes left after admitting that they bullied and harassed a high school girl,age
nan,ethnicity
only two verses and we are making progress,not_cyberbullying
he didnt use the word queer for him idiot and please i have read more ambedkar than you he said that sarvarker thinks muslims will live peacefully within a hindu majority state but he is wrong no matter how much maximum rights he give them chuslims will remain chuslims,religion
rt tonights dessert is called remains of the day mkr,not_cyberbullying
its hard for me to find good marvel schwag ive got a nice print from target lol but dc sadly does better mechandising,other_cyberbullying
shut the fuck up dumb cunt ass nigger coon cunt,ethnicity
grade school bullies have grown up to be antifa boys,age
since the feminists at sorryitsaboy amp everydaysexism now just love jokes i thought theyd like this oneright,gender
protecting shias from isis doesnt include beating peshmergas to death,not_cyberbullying
somebody in the gm was downing black women then had a wreck the universe watching you disgusting nigger,ethnicity
lmfao my moms a bully,other_cyberbullying
when you said “you’re letting the niggers run the school” is what i keep replaying in my head and i’m still sick from it and that was my freshman year you dumb fuck you ruined my high school experience you and your racist friends who are all now trump supporters,ethnicity
i had a very bad day on yearswithexo anniversarymy supervisor and workmates just a group of bitches besides i hate my parttime job ð,other_cyberbullying
they dont have my size too big,other_cyberbullying
i have a stomach ache,not_cyberbullying
rt depends on their costume am not sexist but can women league football ever get the kind of attention the m…,gender
events event suspected terror attack in jerusalem after… arab arabs islam,ethnicity
i guess the police have a history with this person repeatedly losing their dogs or something something bad has them very unhappy,not_cyberbullying
logic is rape is bad it is not about hindu muslim why do you confuse both things some idiots might think of all this be a man be proud dont live in fear fight when there is time else focus on good things why pandering,religion
im in the same boat,not_cyberbullying
does anyone have that video of the white girl sho bullied you in high school reciting her wedding vows,age
uh i am displeased that you want me to reply to these emails with more details when i file a report,not_cyberbullying
booa tarde gente boa tamo na correria hooje logo cedo participei do manisfeto da juventude de foz contra o bulling drogas violencia,not_cyberbullying
if isis has nothing to do with islam then why doesnt it attract jews himdus buddhists taoists atheists christians why only muslims,religion
white girls in your insta dms hey girl so i know we haven’t talked since i bullied you into having major body dysmorphia in high school but i have a great opportunity for you i know this sounds like a pyramid scheme lol but you’d get to be your own boss and the money is good,age
i remembered when i got bullied by this girl in high school for liking lana del rey and she called me a dumb ginger bitch guess what color this girl just dyed her hair lmaoooooo dumb ginger bitch,age
what do mean by produceover million humans were killed when allied forces invaded iraq who were they isis terrorists killed more than million who were theysame quran you misquoted earlier said in whoever kills and innocent is as if he killed the whole humanity,religion
awww she mad rt reporting live from white twitter rt fuck obama dumb ass nigger,ethnicity
sometimes my mom says such stupid shit that i have to remind myself that i protected her from knowing about much of the horrible stuff,other_cyberbullying
for some parts of the company yes a lot of freebsd devs work there,other_cyberbullying
mohammed had people murdered who disagreed with him he raped women he married a year old he beheaded jews,religion
fuck you dumb nigger,ethnicity
rt stuffing up instant couscous should be an immediate elimination,not_cyberbullying
rt“ fuck obama dumb ass nigger” you lil racist ass bitch choke on a chainsaw you fucking dick sucking ass cracker fuck you,ethnicity
im a jerk pvper,other_cyberbullying
too bad i aint packing like that banana ðð,not_cyberbullying
went to my support group at guys hospital today with one of my daughters debbie she bought me lunch on the bank of the river thames then went to the meeting had a talk about radical prostatectomy by mr christian brown really interesting chatted with the group nice day,religion
both countries facing islamic terrorismisrael helped us many times during warchina pla also torturing hong kongers can u say against china,religion
sometimes i wonder if the girls who bullied me in middlehigh school would still have bullied me in college the answer is probably yes,age
in middle school i use to be insecure about being mixed i got bullied because kids didn’t understand how a brown skin girl could have a strong accent long hair amp exotic features amp then i hit high schooleveryone was obsessed w foreign mixed girls the bullying stopped,age
nan,age
girls who bullied me in high school are either a part of christian twitter and tweeting bibles verses or a part of cherry emoji twitter and tweeting pics of themselves licking knives there is no in between,age
would you like to explain what hindus are doing to muslims at the moment india you are either a fake troll account with an anti muslim agenda or a complete idiot you are totally fixated on muslims,religion
“ bruins lost to a dumb cotton picking purple dicked nigger choice” sheesh ignorant as fuck,ethnicity
where is the minority right in pakistan a christian woman had to ask asylum from western countrieswhy she has to plz answer this question first,religion
just a joke i thought gay rape was still cool around here,gender
id be happy to get an adult but leo wouldnt adjust well he thinks he is dominant to everything cant have a big dog he gets protective,other_cyberbullying
same like i said joke around with people you know be gay and say you gon rape them idc but don’t go around setting a bad reputation for others cause it really a bitch ass move,gender
none of them even none of them think why isis not attacking al sauds empire amp his supporters who played important role in spreading terrorism supplying terrorists one group of them brainwash minds of youths fill hatred by lies in name of islam amp quran bidats etc,religion
lets talk about corona this is a china virus chump not an american virus trump did not lie to china chump they lied to the world as hard as you idiots on the left want to blame our president he did x more to protect americans then muslim barry did during the hn,religion
i dont even feel like it he won bitch rt fuck obama dumb ass nigger,ethnicity
bedroom apartment,other_cyberbullying
shame on menaka you were minister in idiot government you were not aware where this incident happens bjp does not know other than muslims pakistan minority,religion
they did its called california,other_cyberbullying
we could do something fun with this i could see how many tweets you get from users youve blocked,not_cyberbullying
no youre just a pussy sexual abuse victims laugh at rape jokes all the time black dudes at racist jokes faggots at gay jokes women usually dont laugh at sexist jokes tho women are like that,gender
ur right about the second and the first one is kalagulabi ladkiyaan,ethnicity
why does kat always need to make big eyes you freak me out witch mkr,gender
newmusic bingsta productionswe got it records llc bully the game produced by,not_cyberbullying
anything can be joked about gays transgenders rape school shootings and race but people on twitter are whiny bitches who can’t take a joke unless it’s family friendly or political,gender
i hate it here why are they excusing the entire point of the show um you shouldn’t be letting people get away with bullying abuse rape fat ass jokes outing people kissing before their ready like tyler did or courtney for making it seem like hannah was the gay one,gender
seen comments from people who knew her at school say she was a bully not seen anything in her behaviour to doubt their word leopards and spots and all that,age
my brother always fucking makes gay and rape jokes i swear to fucking god it upsets me so much,gender
she will often not know it should be opt in not opt out so that he must be told or else they will hide it,gender
where is national treasury youre an idiot amalgamation of was an idea to help almajiri muslim poverty thicking region,religion
rt youre a dumb nigger shut the fuck up who what is an idylan lmfao get out,ethnicity
well peado’s rapists sadists who rape the life of a victim who is not jewish gay or black to make my life about themselves and abuse me cos they’re fraudulent scheming sadists who nick manipulate my life make it about themselves lie laugh in face lie more and joke about raping,gender
i love facebook because it reminds me when all the birthdays of the girls who bullied me in high school are,age
the perfect tour would be the devil wears prada a day to remember miss may i and memphis may fire make it happen,not_cyberbullying
nan,religion
thats right she stands as a christian woman who lies,religion
blumenthal is defending the men who do this to women,not_cyberbullying
alex feels like his life is ruined starting a new school midyear with no friends and a bully teasing him about being gay wasn’t his idea but when his outlandish teacher assigns him a dragon as a pen pal it may start an adventure that can turn alex’s life around sffpit mg fa,age
moms dads key word about school bullying awareness prevention involvementgt worth it to address the issue parenting bullying teach,not_cyberbullying
maybe i’m just an impatient person but this movie was waaaay too long the character development was solid though the movie’s about a middle school bully seeking redemption for his past mistakes it’s about seeking forgiveness and learning to forgive yourself,age
is anyone else disturbed that a fair number of people journos seem to think that making a gay prison rape joke is okay if its about someone they hate like roger stone nope its actually not okay its repulsive,gender
lolllllll,other_cyberbullying
nan,not_cyberbullying
nan,other_cyberbullying
girls who bullied me in high school are revolutions now and im imagination,age
days left gtlt,other_cyberbullying
she looks like the bully that went to church camp in middle school,age
nan,not_cyberbullying
the girl that bullied me in high school just named her child after me perspective people perspective,age
why on earth did i take this god awful fucking shift oh my god,other_cyberbullying
yeah if y’all ever catch me in this help cause there’s something wrong lmfaoooo i would never put on this “i’m a straight a’d white girl who bullied all the weird kids in middle n high school” outfit omfg,age
so youre saying gays can make rape jokes its ok rightsince they r a minorityamp u were in my mentions first mess,gender
headed back to the valley which means back to reality,not_cyberbullying
that black man was just treated like a nigger by espn he said nothing wrong did no harm molly q was briefed to do that in her ear wedge utterly disgusting and unjust amerikkka,ethnicity
social media promotion content creators like videos streams podcasts school bully i hate bullies you hate bullies nobody likes bullies ▼watch more sex in high school art of procrastinating …,age
guy bullies me through my school life i move a out the country randomly texts me trying to illegally sell beer dude if i wanted beer i wouldnt go to you even if it was the last lace available,age
a lot of indie game devs remind me a lot of foss devs its all about that passion im drawn to passion kind of in love with all of them,other_cyberbullying
onlyrealjamaicans eat bully beef outside fi avoid di gingi fly dem frm entering dem house,not_cyberbullying
actually i was referring more to people like mike pence social conservatives not conservatives in general trump isnt a socon radical christian extremists who support big government war and oppression,religion
after he tried pulling the you dont need to be here woman because im so senior and ive already done this,other_cyberbullying
nigger you dumb as fuck,ethnicity
er tweetdeck keeps lagigng out while im typing due to block lists multiple accounts p,other_cyberbullying
now i have to login to randiebooks and add him to the bot base blacklist so uh thanks for that,not_cyberbullying
cant believe the blonde bimboz made it throughthat sausage looked like feces mkr,gender
ignore them dont let them get to you they just judgmental idiots just be you ive been judged in here also for being a revert and posting crazy stuff where all good muslims,religion
they simply said that they were well able to overcome them,not_cyberbullying
hey i want to talk to you about life whats your address rt fuck obama dumb ass nigger,ethnicity
