tweet_text,cyberbullying_type
omg once i panicked because i saw a friend of my school bullies in the store i was i had to hide because i was absolutely terrified i can imagine that senjuro is feeling that but like a thousand times lmao,age
id say prolabor as they call themselves engender the most bullying as theyre weak bully the people themselves,other_cyberbullying
you know what i liked even better how she then proceeded to ignore the actual muslim voices who told her to stop using them for her own agenda fakewoke and white people are terms that were literally invented for these idiots,religion
“ shut up you almost killed a cop you dumb fucking nigger”nigga shut the fuck up,ethnicity
video miley cyrus makes date rape joke at gay nightclub video miley cyrus makes date rape joke at gay night,gender
me too,other_cyberbullying
preseason,not_cyberbullying
you r disagreeing wit all of this bcs uv neva exprncd racism rm a coloured prsn while u are blackthis is no diffrnt thn a white person denying hs family amp friends r nt racist colored ppl who have a lived experience of it because heshe has never exprienced racism from whites,ethnicity
i was the bully unfortunately because it was either bully or get bullied in my school and i had to survive,age
brooooo fuuuuccckkk that submission spot was fucking insane,other_cyberbullying
some pseudo kashmiris shown their respect for isjk terrorists who were gunned down in an operation by security forces today in anantnag not tough to understand that how they are shaming humanity on the name of jihad isisinindia isis,religion
weren’t we taught in high school not to bully people online just my high school okay,age
jackbooted thugs hired by the school yard bully with small hands,age
you should be happy idiot because your favorite army killed an innocent muslim in iok,religion
illogical idiots alway discriminate the persnality it shows that how your parents taught you the ethics and manners this type of actions reflect your dirty mind and also exposes the fascist hatred mind of hindutva extremists against the muslims,religion
imagine signing up to do this for a living what is wrong with you were you the bully in school or were you the bullied angerissues wallofmoms wallofvets wallofvetspdx wallofdads portlandmoms portland,age
i hope men don’t treat your wife and daughter the same way you treat your female colleagues you are just typical misogynistic conservative gop trash though so you can’t complain if someone calls your daughter a “bitch” or mistreats her why is filled with so many cowards,gender
tw rape ray badrans joke was gay ppl can make jokes about being gay black ppl can make jokes about being black i can make jokes about rape,gender
dad just thought that will amp steve were step father and son hahahahaha 😂 mkr,not_cyberbullying
the question is does labour really deserve my vote or does my ballot deserve to be spoilt radical manifesto but a brexit policy i cannot support ge,religion
rt or they say things like were looking to hire more women for our world class team”,other_cyberbullying
dating your middle school bully be like remember that one time you told me to kms,age
ummmmmm sorry “bitches” isn’t pc we call them females now,gender
what a pathetic excuse for an apology you didnt just giggle you shamed and bullied a boy for liking dance it was like mean girls in high school no way you believe what you just said grow up,age
lol would you honestly smack me ahh you a bully blackie,other_cyberbullying
as long as its not an islamolunatic in power that forces sharia on people who dont want it who cares,religion
i didnt understand basic stuff like how to heal up do i have to have potions can i sleep,other_cyberbullying
from a guy that probably supports domestic terrorism vandalism of federal property etc and where are the feminists how dare he call one of my strong female sisters a stupid bitch dude you minivan driving soyboy you are the stupid bitch,gender
really dumb nigger here is actually happening what the fuck up,ethnicity
slap that dum hoe thenpot face bitchrt bitch ill murk yo ignant ass “ fuck obama dumb ass nigger”,ethnicity
nippy lied people died you time is up nippy your parties time is up nippy youve been taking the citizens of scotland for idiots for too long nippy and youve been found out now covering up a corona outbreak covered up muslim child rape gang games up nippy,religion
you must be an idiot just say sarpanch killed so far panchsarpanch killed in valley only is hindu remaining all are muslims so this is the political killing amp dont try it paint it else to please your masters,religion
mkr omg my dad and i are screaming at the tv,other_cyberbullying
no such thing as prophecy of hadith those tribe ghazwa e hind are essentially a rebel group of islamists formed after idiot modi formed the bj i mean bjp party to kill and repress muslims and strip them of citizenship that video you linked below has no indication,religion
can men please stop shooting people for a goddamn second,not_cyberbullying
rt sum things jus arent right coming from a girlz lips notsexist,gender
idgaf if it’s not all white people the ones that it is ruins it for all of yall white people their ancestors have waaaay to much blood on their hands for black people to forgive or get past anything,ethnicity
even a dumb nigger wouldnt fuck you,ethnicity
lls more years lil cracker rt fuck obama dumb ass nigger,ethnicity
d php d,not_cyberbullying
ubitusher the solution is less regulation smarter regulation that remains capitalism stop supporting islamic terrorism and theocratic governments and to reduce the power of re,religion
thoughts b would i apologize to those ive picked on and real question would i even knowremember that id bullied them,other_cyberbullying
manutd arent gays wankers boring joke rt loooooooooooooooooool rt arsenal will rape united dis weekend,gender
,not_cyberbullying
as another fellow gay please don’t compare reversing on the highway jokes to rape racist and homophobic jokes,gender
no ones antimuslim their antiradical muslim you should know you support the terrorist organization hamas not only do radical muslims use their rhetoric to justify wars amp oppress generations they use it to murder christians practice honor killings and mutilate girls,religion
twitter already does this to an extent can only create n accounts at a time without having to wait,other_cyberbullying
did you really forget you lied to megyn kelly about giving hrc the questions ahead of the debate you lecture republicans on lying but you’re a christian woman right,religion
more rigged than the block this will be the last time i tweet about and even watch mkr,not_cyberbullying
ur username is the first one to catch my eyes tbh,ethnicity
i have no idea how anyone is seeing blue at all i see no blue,other_cyberbullying
my brother is a marine and i showed him that to shit y’all talking bout and he called y’all a bunch of dumb ass niggers also suggested y’all shut the fuck up,ethnicity
why cant i dm you,other_cyberbullying
i just showered in the hottest possible water while and exfoliated like crazy for the past minutes not even joking fu science,other_cyberbullying
it was bought by sultah fateh how do you disown a property belonging to muslims idiots,religion
tell that to the harley davidson workers who lost jobs bc of your bullish approach to chinese imports i agree on being tough w china but your way of doing it hurts us almost more than them think smarter more strategic being the bully in grade school approach doesn’t work,age
attacking people out on social media is pathetic dudes acting tough for likes one of them will bite back sooner or later beware the wolf in sheeps clothing reminds me of a school yard bully who got fucked up by the skinny kid he picked on,age
illegal really i should be able to arrest all the bullies at my school if this is illegal,age
buttsex something gay about a celebrity rape joke boobies food tv show im watching random picture boobies titties vagina penis,gender
gym i knew but he wouldnt let me watch jordan still has yet to answer for his failure to report the sexual abuse of athletes under his charge despite his juvenile middle school bully persona or maybe because of it he is now the ranking member of the judiciary committee,age
payton rae supports bullying prevention via,not_cyberbullying
looks like the police r up to there usual bullying again,other_cyberbullying
sectors of the gay male community actually turning against sue perkins because she said rape jokes are not ok this world is a freak,gender
no because she is a huge phony was bullied in high school and called the n word by some white girls had the naacp sue for her for a huge sum of money she hates when blacks are victims unless it is her,age
and while we’re here please retire the maleprison rape jokes about becoming gay or being feminine for being a rape victim that shoulda never been a thing,gender
this is an isis account pretending to be a kurdish account like islam it is all lies,not_cyberbullying
one of the girls who bullied me in junior high school sent this to me this was me in th or th grade i wrote a paper on benfranklin i dropped out of school in th grade and received my ged before my class graduated trumpdc has a monument benjaminfranklin,age
meh he called me a name and i’m a snowflake and need to stay in my safe place the maga cult loves name calling and doesn’t believe in politically correct remember what do you have against muslims or arabs shriners clearly use arabic and arab names but also hate them idiots,religion
from now on obama staff will manage this account tweets from the president will be signed bo hahaha bo what a fuck up dumb nigger,ethnicity
vou sofrer bullying,not_cyberbullying
its mechanical,other_cyberbullying
nan,other_cyberbullying
putin shelled ukraine civilian and tried to blame ukraine,not_cyberbullying
this nigga just tried to bully me for my mucho mango arizona,ethnicity
people bagging on the “tall girl” movie look just because you didn’t see bullying doesn’t mean it didn’t happen i was bullied as a kid for being tall and after i hit high school it lowkey stopped because the people who bullied me finally grew i wouldn’t say i was oppressed,age
idiot craig didn’t write about kalam he took it from muslim theologians also can you show us multiverses you want to see god but use the crutches of a “theory” you can’t prove yourself brilliant,religion
a black person who sells out and kisses up to racist white people especially those who defend racist white people against blacks an uncle tom what malcolm x called a house negro,ethnicity
podcast we speak to cj scarlet she is a danger expert and author with millitary and grandmother experience we talk about bullying in school and online she gives actionable steps that parents can use to help their kids deal with bullies,age
i was not bullying her shes trying to steal jean martyn from meee xx,gender
watch audience revolts after margaret cho jokes about rape whites gay people breitbart,gender
there arent any muslim terrorist isis and others are not muslimsthey decline orders of god written in quran and muslims have exonerate theirselves from them shitte and sunnahboth had said that those terrorists are not muslims,religion
you would chose a like this lol im glad weve remain friends even after all your bullying lol,other_cyberbullying
wowrt look at these dumb white ppl in the south “ fuck obama dumb ass nigger”,ethnicity
bro first learn something pubg pc is owned by bluehole pubg mobile is developed by tencent pubg mobile is published by tencent pubg mobile privacy policies are maintained by tencent its more chinese than you think seeing one line in google wont make ur facts right research,ethnicity
kim jong un embraces islam,not_cyberbullying
if we assume ashs ability to heave an entire tree trunk over his head is a power yugioh easy pretty sure joeyjounichi and tristanhonda were high school bullies and i think the only two in the list whove been in a fight before,age
i think i just saw you,not_cyberbullying
you dont have to have a phone to get sms you have to have internet which is also required for twitter,not_cyberbullying
yessss quiet fist pump i am a trendsetter,not_cyberbullying
my mother was a very devout christian woman who made her views very plain when she was able to it was nonnegotiable for her so regardless of your opinion it was the right thing for our family,religion
a republican congressman calls a female democratic congresswoman disgusting and a fucking bitch on the steps of the capitol building helluva lot of class and dignity hunh oh and hes from florida a hotbed of tolerance say hi to matt gaetz,gender
rt fireworks,not_cyberbullying
watching middle school bullies indulge in collecting crystals is funny to me,age
youre being a racist nigger what the fuck was going through her head when she said that dumb ass shit,ethnicity
i used to want to be a cop but definitely not anymore lol once u kill a different colored person half the nation thinks it was bc of racism,ethnicity
then again you are black and usually niggers are dumb as fuck,ethnicity
ahhh bby i feel you may whatever you decide to choose be what is best for you ameen if the first one is ur dream job then i’d say it’s worth waiting for,ethnicity
koscielny off which liverpoolfc have to take advantage of rookies in this arsenal back and carroll needs to bully them,not_cyberbullying
ok im done that mole got through outrageous mkr,not_cyberbullying
i will not return to after today yes i love their food amp customer service but i’m taking a stand that they could not i won’t support as long as it sacrifices its christian beliefs caves to the radical leftists conviction maga qanon wwgwga,religion
anyone else as disgusted as i am rape is not a joke it is not a false accusation to make to further your political agenda oh and by the way gay people aren’t inherently rapists or pedophiles these men should be ashamed,gender
i’m a mom of a yoaoc spoke for my daughterst time she was called b was in middle school for standing between bullies at the bus stop amp a boy who didn’t dress as gender specific as themshe impresses me every dayshe is not the extrovert of the familybut she is a warrior,age
rt syria raqqa popular resistance implemented a attack on a isis hq in rusafa الرصافة neighborhood in raqqa,not_cyberbullying
she founded shes loosing then she came on point that u r breaking and have to b fight together these bloody hate mongers are loopholes of our country who are become a bedbuggers of our country who are sucking the blood of by living in the same the radical islamic terrorism,religion
thank you i become upset i can see the outcome it was lbjs prized great society however it was a ploy to get black people to vote for him he was a wiley disgusting man who literally stated we will have those niggers voting democrat for rhe next years,ethnicity
hm first of all duniya chutiyapa hai he n by chosing go with flow we somehw losing ourself then why not we flow as we want i m not saying u to flow opposite but why not beside why not u build ur own own flow life is all about one chance so duniya gayi tel lagane,ethnicity
these girls make up stories about being bullied as a kid like you know we all went to the same high school right lol,age
most of them aren’t even here for bts but to live out their high school bully fantasy,age
is it considered racism if u separate the whites from the colored while doing laundry,ethnicity
what i got bullied over glasses getting good grades being fat not going out drinkinggenerally being a goody two shoes and since i was verrrry shy around girls some gay slurs too high school in the s was so much fun,age
a california woman who was on her way to the principals office at her daughters high school to report that her daughter was being bullied says she was brutally attacked on campus by two teenage girls,age
acts of god is of which means originates from stems from is appreciative to the divine dark skinned golden negro hebrew jews of gods people see st john and also to those of the white species nephilim creature people called tares of satan by god,ethnicity
just thinkin’ it’s kind of funny how the girls who bullied me or others for being a little chubby back in middlehigh school now look like the very girls they bullied maybe you should’ve minded your own business,age
rt im not sexist but holy shit women drivers are awful,gender
ive been watching jenn for a while deciding if it was worth saying anything her tweets are benign but the response is not,not_cyberbullying
i saw this girl get bullied on the stairs in high school and stopped dead in my tracks to figure out the issue never will i stand around and watch someone get bullied like this let alone someone who is special ed idgaf we will be fighting,age
ash and camilla is the peoples choice their dish were great mkr,not_cyberbullying
as usual he will say that islamist terrorism has nothing to do with islam,religion
hours and minutes omg you guys i cant even,other_cyberbullying
did you read the text of the article that picture is really creepytriggering as fuck,not_cyberbullying
offensive gay joke rape joke,gender
ay ay ay indaba this is coming from a political party that calls themselves fighters and displays pure racism toward colored white and indian ay boys tata castor oil u full of shit you will do the same here to our people,ethnicity
video miley cyrus makes date rape joke at gay nightclub,gender
mop up,not_cyberbullying
christians in nigeria face immense persecution fearing abduction torture and murder by radical islamic jihadists just before one pastor was killed he boldly told the world “don’t worry but thank god for everything”support aclj,religion
says who if you with the rest of the idiots out there would like a demonstration on how ineffective masks are i would be happy to show you you should not believe everything you hear out there without proper research that’s the problem with today’s society monkey see monkey do,religion
trump starts gassing muslims you idiots don’t worry guys the pee tape is coming out any day now,religion
shut the fuck up no one asked you for a opinion you dumb nigger lt hahaha fucken laker fans huh,ethnicity
in austria an opinion poll shows the greens ahead of the social democrats for the first time although the difference must be well within the margin of error support for the radical right is also the christian democrats,religion
yes those millions that wont let women drive in saudi vote in kuwait and cut their clits all over,religion
dude your a joke can you just shut up first chikfila now spinning the rape comment we get it you hate women gay,gender
i rmbr in hs once this kid was exposing something about racism in a book and he said colored people so im like do u live in the s,ethnicity
i have family living in dubai granted they are leaving soon after years my aunty had all the rights she needed as a christian woman and they weren’t rich but lived super comfortably so yeah i’d take dubai hhha,religion
once again i don’t give a fuck if you hate me lmao you over here worried about my dick lmao dumb ass nigger,ethnicity
pussy licking pussy meow meow stopwhitepeople think about how passwords work are they stored in plaintext can the provider easily decrypt them nope im living proof that fat people can glam fashion it up despite most of those plus size sites having the ugliest clothes what i am a lesbian it is my job to hate cishet men i signed a damn contract the place next to little caesars on san pablo in emeryville i played the video for him and he stopped i have some pretty fantastic wonderwoman stuff but i prefer marvel hands down dc chars seem to emo it is great to hear that theres more women getting involved with freebsd the community is fantastic and has always been supportive while you can hire a lawyer to help you speak to the police thats kind of where their and your involvement ends my yr old cousins fb status were depressing iasked if she was okthen if she was being bullied she wrote back only by you at the moment just change your profile picname to a woman pref wbrightly colored hair tweet out gamers are dead or games are sexist,other_cyberbullying
its tied to twitter user ids and its not a constant update it updates when i run it,other_cyberbullying
you couldnt explain all that without calling me a dumb nigger or nagger or what ever the fuck,ethnicity
he joins candace owens terrence kwilliams diamondsilk they are not black republicans or black conservatives theyve crossed the line into being totally white washed they are the antiblack black people malcolm x called them the house negro,ethnicity
laying down watching school daze,not_cyberbullying
what plies tours concerts merch branding deals anything you seen since a few singles with buzzing artists to make himself appear hot again and turning into a social media comedian with “sweet pussy saturday” fell off no one in the past years said “turn plies on”,ethnicity
madison looks like a girl who would have bullied me in high school thebachelor,age
well said you wouldnt see that at a jesuit school we keep the christ in christmas,not_cyberbullying
workplace becomes new schoolyard for bullies bullying can be just as big a problem for adults in the workplace,not_cyberbullying
oh really islamists like you are blinded to islamic jihad and are no different from isis terrorists it is evil quran that divided humanity into believers and infidels,religion
it’s trending that a white man called a black man a negro because of an argument they’ve had,ethnicity
you lazy dumb niggers have had s of years to get w the program fuck obongo and niggers,ethnicity
nan,ethnicity
too bad that uber is a middle aged bible thumping christian woman who hasn’t heard of blink and won’t remember the name right to tell her kids,religion
damn niggers u to young for that young dumb fat thot — lol this my pussy i fuck who i want amp fuck who i do,ethnicity
this website is a terrible idea this has to be illegal this is clearly prone to harassment amp abuse,other_cyberbullying
snooor,not_cyberbullying
my boyfriend is bullying me,other_cyberbullying
this is the best account,other_cyberbullying
did you have a chance to do that thing we were discussing at ladieswholunchslc,not_cyberbullying
remember when girl in high school bullied me for posting selfies on a thursday,age
happy birthday god bless you,not_cyberbullying
you cant get any sicker than the muslim animals following the instructions of their pedophile prophet,religion
to bad we beat your ass in giantspride,other_cyberbullying
those views are written in the quran and hadiths and are polled by pew research idiot,not_cyberbullying
years post high school you come across your worst high school bully ever youre their new coworker whats the one thing you wish you could say to them but you know good and well you will never say,age
we clapping for cough syrup drinkers fuck dumb niggers,ethnicity
dr king about unemployment when you have mass unemployment in the negro community it’s called a social problem when you have mass unemployment in the white community it’s called a depression there r some issues that demand spurs and basic income cant deal with jg pge,ethnicity
lol watching the girls that bullied me in high school still watch my snap from their subscriptions is confusing as hellll block meeee,age
lara spencer is so unprofessional she bullied a young boy on national television for taking ballet i wonder if she knows how foolish that makes her look this is totally mean girl high school behavior ps the bystanders who laughed made it no better,age
rt its melting because you didnt put it in the freezer before you served it you dumb skank mkr,other_cyberbullying
this poor kid’s high school life is ruined forever imagine this video pops up guys can tease and bully you till you drop dead,age
and if your going to go after “slave owners from the past” i would think ya started with democratstheenemywithin and chase them out first the democrats was the last one to go to a former kkk funeral ur going against wrong people,ethnicity
they trying to cancel eddie murphy for his standup comedy from fucking years ago for his “uncalled” for gay jokes but tyler pre flowerboyigor was about homophobiarape but thats suprisingly ok lol im not mad at either though,gender
i sure am hungry for some scrambled eggs,other_cyberbullying
nada conté un pésimo chiste digno de bullying similar al de ninel o de las señitasdepolanco,not_cyberbullying
nan,age
if u r a literate person please read the article and not the heading of post article is about what happens to secular hindu in muslim majority but if you still going behave like idiot and cant understand muslim mindset then forgive me,religion
twitter group chats are where grown adults get to bully people like theyre at a middle school lunch table,age
beaut happy birthday too xx,not_cyberbullying
as a target of her delusions yeah im going to say these things about how she behaves towards me,not_cyberbullying
that is why the jewish state looks like this,not_cyberbullying
yeah we just exchanged waves and smiles,not_cyberbullying
to everyone who voted conservative fuck you it doesnt take a fucking genius to read the manifesto and think youre laughing at america now but youve voted the real evil into parliament an idiot with a posh voice that old white men who hate muslims adore,religion
the sassy foods feeling mkr mkr these girls are vile people killerblondes basichotdog nobun,gender
oh so i guess what i will be doing is purposefully not writing aint gon bully me,other_cyberbullying
try sending the bible to some muslim lunatics saudi wont even allow it in the country more religious freedom in israel,religion
