tweet_text,cyberbullying_type
pleaseck us out sending out a positive messg live health awarenessstopgangdrug abusebullying ect,not_cyberbullying
make sure the security council deserves an israeli nuclear disarmament every hamas and islamic jihad terrorist shall now die or surrender treat the prisoner with humanity only the surrendering prisoner carnage all others fighting gods wars,religion
girl it must be so nice living in this delusion that a white christian woman has the right to steal a role like that if the directors really cared they would’ve looked until they found a muslim actress or made the season about another character,religion
some female rappers do call themselves baddest bitch baddest ho but when you call them bitch or hothey get angryfuck em emmettbabyboy,gender
acts and the satanic diabolical enemy sowed white species nephilim heritage tares among the divine dark skinned golden negro hebrew nations of gods creation called wheat by god also good seed and sheep by god in gods field which is the world,ethnicity
the sick ass bitchwas sickeven tried to put child endangermenton meto get her hands on our sonthe allegation,gender
glad to see has gone from sponsored tweets to fullon native advertising and by glad i mean nauseous,not_cyberbullying
nan,other_cyberbullying
there were no muslims in the land of israel why you keep insisting that place is urs u lunatic it’s not urs and never will be urs ever what belongs to u is mecca and madinah that’s it idiot,religion
that was a comment taken from polygons article on the rtb panel,other_cyberbullying
who is doin this under the age of nigga no one cuz they all mediocre as fuck whew jesus the niggers that surround him truly are just as dumb amp delusional aint sold out nane concert or topped nobodys chart but he supposedly doin it pictwittercomgzfgnzbrr,ethnicity
i have posted this disgusting image before and make no apologies for posting this again these are black people probably from niger bound ready to be sold as slaves in libyan markets to think this exists in is an abomination,ethnicity
if the only devs standing up are the ones that havent made mistakes all devs should be sitting down,not_cyberbullying
manrriquez cuando sufres de bulling q te golpeaban y tratabas de hacer el kamehameha y aun asi salias golpeado o,not_cyberbullying
so he can call female colleagues fucking bitches as long as he feels justified must be a joy to work with s,gender
you are so pretty omg you kind look like peggy carter in the first one if ur a marvel fan hehe i like the choppy bangs in the third one btw it suits you,ethnicity
sexist rape culture only exists when straight men are doing it if liberals especially gay ones do it they’re aok doublestandards,gender
may not seem that far out of reach to a lot of people in the us but were also far removed from the class it would impact,other_cyberbullying
i don’t say it’s wrong because it goes against trump you idiot i say it because he got to go to the nfl and make millions of dollars he didn’t even care about you until he got his muslim gf at the time you know that right hes disrespecting a country that has given him so much,religion
the us has never had the peshmerga on a terrorist list microbrain,not_cyberbullying
rt cant stand female announcers doing play by play for football not sexist but every time i hear holly rowe doing a game i ca…,gender
niggas used to bully me and call me a squirrel in middle school lol i ain’t forget,age
opt in solves these problems,gender
you idiot if someone had an affair with your husband and you found out who they were what would you do this is simply a domestic affair it could happen in any country nothing to do with insaf all these so called muslims justifying an adultering actress makes me sick,religion
he will never win a cup for this stunt carma,not_cyberbullying
rt call me sexist but of yall women cannot drive man and of yall read this and said not me in yall head,gender
all the girls who bullied me in high school are pregnant,age
rt im not sexist but hearing a group of drunk females trying to do the yayakolo toure chant feels wrong,gender
we have a same views on people like u who r suffering from hinduphobia people like u promote islamic terrorism or radicalization spread venom through ur baseless articles that islam is in danger bla bla people like you are the real reason for unsettles in name islamophobia,religion
rt dont get your pants in a bunch im not sexist but in this pc geekdom world heaven forbid if you disagree,gender
black people cant say it without getting suspended dumb ass the school doesnt give a fuck its wrong no one says nigger anyway,ethnicity
bullies are just very insecure about themself and want to make other miserable ive had my share of being bullied all in high school,age
i don’t walk around saying “males” i say men or boys so why is it so hard to say womenan lady or girl “female” bothers me sometimes bc it’s normally in place of the word bitch if you wanna call me a bitch just say it but some ppl gave female a derogatory context,gender
really hoping ’s zombie team pares the rape jokes gay jokes and japanese stereotyping with ultimis way back if they show up again in bo or any future cod for that matter richtofen sexually assaulting dempsey wasn’t funny in it’s not funny in stop it,gender
no feminism opposes choice of parenthood via financial abortion for men,gender
hey jimmy keep your suggestingyouropponentsaregay jokes in your closet what next rape jokes theyre not funny in,gender
it’s the fact that all through middle school little white girls use to call my braids “horse hair” and bully me for saying that it’s still my hair because i bought itwhat a horrible time,age
p fwiw im usually pretty careful about calling for the head of anyone,other_cyberbullying
what kind of drug are you on your insecurity abroad needs psychological treatment and not dumb editorials seditious many are raising money to support radical hindu organizations to wage violence against religious minorities including muslims christians and sikhs,religion
but barry bonds still has the homerun record right,not_cyberbullying
men when they think saying any slur making racist jokes “retard” “gay” any rape joke think they so tough also men when we say they are not funny,gender
twinkle twinkle little whore youre at school not jersey shore youre a slutty orange mess please go find a longer dress,gender
the full body project by leonard nimoy nsfw,not_cyberbullying
i guess youve never saw a muslim who turned into an atheist i guess go out of your bubble theres a vast world outside and i am not a part of hindu community so no i dont have and am not asking for a place in hinduism,religion
i was literally ft tall all through high school and was never once bullied to my face anyway idk because i was a big bad bitch and people in my gradebelow were scared of me and the older grades didn’t give a fuck so tall girl isn’t that realistic,age
g lh yov nek di bullyplg km t jdno paq p,not_cyberbullying
chalips who also ravaged killed raped prophet mohamuds family membrs including kids women and imam husain isis and other terrorist inhuman organization are inspired by these greedy caliphs who changed islam and quran,religion
i hear you on that when you’re a teenager you don’t want to be cooped up with a bunch of people that are judging you you want to be out enjoying your life i hated school and always skipped out on classes especially classes i knew had bullies i was that weird kid that,age
i have no intent on linking to the articles where he stated he was backing out they were an attempt to save face not an apology,other_cyberbullying
many muslims in gujarat vote for bjp too thats no point if it was a natural disaster after killing of one person after the godhra train burning the natural disaster should have been times stronger i am not with rss but your single digit iq says you are with idiot pappu,religion
nan,ethnicity
a lady must be two things classy and fabulous,not_cyberbullying
hate when people say im not a bully lemme define bully is someone who causes physical or verbal harm on someone idiots,not_cyberbullying
you worried about somebody bein ugly bitch you ugly,gender
i think we need to stop using the word christian to refer to these people given they support a man who is unarguably the antithesis of christlike how about radical evangelical extremists,religion
one of the things i seriously considered when naming my baby was if and how the name would be used to bully them in middle high school these people did not,age
im sorry your feelings were hurt that must be terrible i would know nothing about that,other_cyberbullying
buhari sponsor jihadist terrorists forget that christian community worldwide not leave alone brothers sisters persecuted not abandoned make reason buhari clan jihad is your end soon in jail crimes against humanity,religion
i have to be the bigger man in thisfuck u u dumb nigger your the racisti will find a way to get the fuck away from u,ethnicity
gay catholic school life was getting into fights and the teachersprincipals only yelling at the bully because they know your gay ass ain’t start it but finished it,age
wat,not_cyberbullying
no seriously read that rt in dwights voice,not_cyberbullying
me stares at dad after he says something dumb dadfuck you ugly jew bitch me nigger dad youre adopted me dad yeah shut up jew,ethnicity
remember those good looking girls at school who thought they could bully everyone and get away with it janegotjustice,age
and being bullied by kate lol,other_cyberbullying
doesnt everyone call their female colleagues fucking bitches no oh well what a guy,gender
reason why i dont have females friends bitches will sit in your face amp text your nigga or the nigga you fucking bitches will sit in other females faces amp let them talk shit about you bitches will try their best to be just like you ampamp call it competition bitch,gender
do you think they invented the hashtag before they invented twitter,other_cyberbullying
la vem vc fazendo bullying comigo vc abusa de mim só pq gosto de vc mimimi,not_cyberbullying
school website,not_cyberbullying
exactly what the fuck i thought “are you triggered my middle school teacher made us say nigger it was horrible ” also this dumb bitch “stevie wonder being blind will forever be funny it’s so small are you on crack” pictwittercomtezbucqkk,ethnicity
if the palestinians had the ability to make it happen it would be the other way around,not_cyberbullying
done definitely a female who has no self esteem to call herself sweet bitch,gender
nigger a word so vile so disgusting that only black people can use it mob sgp tcot tlot p p cspj,ethnicity
and u have all these black cops playing house nigger to the white sargent it was fuckin disgusting if you ask me,ethnicity
malcom x wasn’t wrong when he called y’all house negrosalways at the white man’s ass blackhistorymonth,ethnicity
heidi n closet was that one girl in high school who defended the bullied white gay,age
people who oppose gay marriage should die people who support racism should die people who support rape should die don’t agree i don’t care because there are memes that joke for said victims to die here’s your taste of it so tell me this is america,gender
the “omg i hate quirky girls they wanna be different so bad” is just repackaged misogyny and ur inner middle school bully is jumping out,age
have fun on the wrong side of history all female ghostbusters no i am not sexist but fuck that shit,gender
rt the only position they belong in haha notsexist,gender
i love these liberal women who get all excited voting for a muslim do you idiots even know what sharia law consists of oh you dont think it could happen here maybe you should check out dearborn michigan and see how close they are,religion
being black and being bullied in america is nothing new to the majority of black people dontfetit,ethnicity
i dozed off and missed mkr let me guess kat was a see you next tuesday 😉,gender
you dumb as fuck you fat nigger bitch my last name is koo so shut your fat porkchop eating ass up,ethnicity
tw rape i’m not even going to rate it because it’s so problematic there rape jokes cultural appropriation amp mockery the main character has no personality being gay is frowned upon,gender
as someone that is continuing to be harassed by ed since it was formed over a decade ago can confirm,not_cyberbullying
thats not funny,not_cyberbullying
i hate seeing girls that literally bullied me in high school now fawning over harry styles not cool man not cool,age
curious so for the rest of the non bay area country is it normal to see a tweet make news,other_cyberbullying
penguinman is a regular poster to baph the board that coordinates targeted harassmentstalkingswating,not_cyberbullying
rt feminists when other women dont fall for their shit feminism womenagainstfeminism,gender
no peta are idiots doesnt justify her jumping into the debate either if you eat chicken cos you are a konkani muslims can eat bakras as well lets keep the debate fair,religion
“ fuck obama dumb ass nigger”stfu you mad bro lol lt jit maddh lmao,ethnicity
it actually needs to be repopulated because it’s impotent they are cowards of the worst kind scared of the schoolyard bully and unable to do their jobs name something of value the trumpgop has done in was it worth the soul of the nation,age
i would rather eat my own arse mkr,not_cyberbullying
they dont care if the harm the trump administration is causing ever ends they just want to stop hearing about it so they can go back to telling their jokes about rape and how theyre totally cool with gay people but they still think gay sex is weird,gender
rt i cant believe my wikipedia page is under attack again dont they have policies against all this,other_cyberbullying
how because he used the word rape and didn’t want to cry every second how about we don’t joke about death or having leg or being gay or religious because or atheist or ginger or too pale or too black or looking weird or how much you wear make up or poverty or hungry people,gender
i dont make racistpedorapegay jokes those are not jokes to me some folks just like to make excuses for foolishness,gender
heh thanks i try it just gets tiring and wears at my resolve sometimes im worried about writing off things i should hear,other_cyberbullying
typical nigger i thank gawd namsayin gawd keeps me goin fuck you rasist ass cuntjust as dumb as the rest,ethnicity
well jerry fakewell jris an evil smelly radical lying religious fraud christianity today real christians he amp fraudklin graham fraudla white jim fakker evilgelicals all who support the orange antichristarent christians amp would crucify christ today,religion
he was a high school kid geez these people just crazy when did it become ok to bully children ohhhhh the hat makes it ok they are crazier every day parents pay attention,age
trumps behavior goes back even longer he learnt how to bully early sadly he has been enabled since grade school he does because he can in my opinion trump is evil thanks for your insights take care,age
blowing kisses to hatock before we battle selfie warcraft,other_cyberbullying
harley quinn,other_cyberbullying
the prophet mohammed used catapults on cities killing women and children so you just called him a coward,religion
i uploaded a new track brothers at arms obamalaw and feminazis on coasttocoast feminazi obama,gender
i just followed and let me tell ya shits cute,not_cyberbullying
why dont you scroll down and find one of those so called fake muslims advocating for literal jihad hes right on this thread tell me hes fake also ive done more to support palestinian rights than you have dreamed of idiot but sure keep moving the goalposts,religion
barr was a bully and a racist in high school just type “barr bully” into google and read articles why is he attorney general,age
would love to go but got to be at the hospital with the daughter,not_cyberbullying
bullying co pereirao na facul finaestampa,not_cyberbullying
erdogan supports isis al qaeda muslim brotherhood and other terrorists groups hes invading syria and libya while provoking greece simultaneously however because he reads few verses of the quran something of yall do every single day in salat yall simp unconditionally,religion
im terrified every single day of my life of the fact that people think i know what im doing gameloading,other_cyberbullying
last thing we need is another dumb nigger in the team lmao fuck outta here boy,ethnicity
everybody knows a girl who knows a girl who got bullied by taylor swift in high school,age
just curious girls with onlyfans do y’all ever think of how much your kids might get bullied back in high school i remember foos used to use their moms picture off fb to roast now imagine,age
omg me that saying is dumb as fuck amp makes u sound like a dumb nigger rt wordsihatetohear you dead ass,ethnicity
rt now lets be clear its not the minority within islam that believes in violence against blasphemers its the majorit…,religion
jihad was against evil thoughts injustice by prophet mohammed but the extremist idiots like you have started against humanity kafir by just seeing non muslims your judgment day is near,religion
thats the best you can is spout abuse because i have an opinion idiot if j witness a catholic or christian decided to pitch in a muslim neighborhood and just pray would they stand for it no so fck off england is not a muslim country,religion
i would be shocked if there are many people that have been the target of callout culture mob harassment that say callout culture is good,other_cyberbullying
mark you are racist even after being part of bafana bafana you are still racist you didnt learn anything about black people all that time what about injustices of the past so are you proud that because of the the color of your skin you were privileged in all aspects of life,ethnicity
this is political opinion the truth is that islam is itself radical and we must outlaw it,religion
smoke till im insane drinking till im throwing uppp,not_cyberbullying
“ fuck obama dumb ass nigger” watch ya mouth,ethnicity
and the kids that were terrible we’re most definitely dealt with this isn’t about pe or competition it’s about a school who maybe has a shitty teacher and shitty kids who bully that has nothing to do with pe or what the class is for it’s just shit people being shit,age
we dont support saudi at all we simply do business with them the saudis were produced by islam,not_cyberbullying
rt blog what is difficult is having any conversation at all while i am in the process of being raped trigger warning,not_cyberbullying
why is it so difficult for people of different castes to intermarry as far as i know a girl with a low caste needs to spend a lot of money to marry a man with a high caste otherwise she will be easily bullied by men what is the caste of your wife,age
kat and andre cant cook mkr,not_cyberbullying
the american evangelicons only politicize christianity and have been promoting their perverted creed they turn their backs on certain christians but promote the cause of others depending on the region these radical terrorists support a belligerent amp bloody foreign policy,religion
“ fuck obama dumb ass nigger” • hey cracker go suck a black dick nigger that hoe teamaobama,ethnicity
the slurs weren’t even the worst of it she deadass made several rape jokes at the expense of gay and trans women,gender
yup people should be able to do whichever they want,other_cyberbullying
man you bulling,not_cyberbullying
youre an anti semitic supporter of radical islam you know the ones that behead christian people and sell slaves in libya guess which one we support trump,religion
i know so cute love the way he spinelessly dives in to being a bully to win the girl,not_cyberbullying
learn about people you idiot he is not from the western world where if fam member dies you questioned god he is muslim if you know about the religion were thought that they are in a better placewe belong to allah and him we shall return doesn’t mean he doesn’t love his dad,religion
taller than me obviously smarter than me tattoos or piercings not too skinny not too buff just in the middle hardworking in school or work in general will not bully me and hit me because i’ve had enough from my ex and also i want my soulmate to,age
haha did you watch big brother “zankie” was disgusting and literally a straight guy and gay guy “playing it up” also frankie made rape jokes and literally said being lesbian is a choice unlike being gay cuz he’s a mysoginistic ass i am like,gender
and i couldnt give less fucks about alienating followers by giving them an opinion they dont like,other_cyberbullying
the girl that bullied me in high school posted something about mental health awareness recently,age
a girl who bullied me really heavily in jr high school really wanted to be a marine biologist i somehow dont think she amounted to thatgood,age
if you did your research you wouldn’t need to be educated the national language of somalia is somali idiot arabic is there because majority are muslim,religion
know that im asian too you bitchbut just know that a nigger is a lot more educated than you you dumb fuck,ethnicity
both daesh and shia militia are driven by a religion of hatred and bigotry and there will be no freedom in tikrit regardless,religion
woman dev audience i think the real msg i want to get across is that anyone can make a difference even with just a line perl script,other_cyberbullying
one day these kids that they are teaching to be angry are going to be bullies in school and eventually school shooters,age
how do you respond to your bully in school trying to friend you on facebook years and i still hate his guts,age
please if you disagree with harriet harman please follow rt dontdatesjws,gender
i think its time to get rid of teams scoring other teams its not fair mkr,not_cyberbullying
mutual follower collusion,other_cyberbullying
ripantoniomartin fuck you dumb niggers,ethnicity
mere muslim friends hai jo aisa nhi sochte because its literally stupid just like prashar smrti promoting sati similarly you can also claim that bible promotes slavery but idiot thats not what people believe in cherry picking things from religious text is a,religion
you dumb idiots why would muslims who dont believe lord sri ram would visit ram mandir only people who have faith would enter why should we ban people who loves to visit ram mandir even lord sri ram would not consider it as fair bannonhindusinjanmbhumi,religion
rt questionsformen did you know rape is bad,gender
first youre an idiot then youre a republican kris kobach wizard of crosscheck border wall muslim ban amp more,religion
rt im not sexist but both of out females managers are fucking retarded and overall useless,gender
these liberal idiots have no idea what muslims are doing here for years they accused north indians specifically hindus accusing them for killing muslims you can guess the reasons and it turned out to be fake so i guess its fair to paint the opposite when we have the chance,religion
so i guess its really happened the mkr competition is running for eternity,not_cyberbullying
rt and that is how forcesargeras finally decided to abandon gamergate,not_cyberbullying
hahaha you havent seen mean girls so i cant take you seriously,other_cyberbullying
damage is self inflicted he is an idiot,other_cyberbullying
just in case anyone is down for some meatballs…,other_cyberbullying
thats idiotic not holding a sick terrorist god sacred is far from not holding anything sacred,religion
ppl in school rape jokes suicide jokes gay slurs racial slurs etc are not funny and they will never be,gender
i will never call a trump disciple suppremacist karen i was bullied at school because my mother was my teacher i think to all the little girls who are name karen childrens could be stupid theyre bullies who will try to find all the excuses to bully,age
lilia cabral sofrendo bullying na novela das finaestampa,not_cyberbullying
,not_cyberbullying
he got his start with rape jokes and using gay slurs a lot so hes always been trash,gender
according to your own canon your prophet is a pedophile murderer rapist caravan robber slave trader sexist and bigot,religion
love the way u always stand up for when all the other wives try ti bully her im glad u have her back husbandoftheyear,gender
deconstructing everyones a little bit gay quote and rape joke,gender
the weak sensitive kid start at home give them everything they ask for never question them for anything take him to school every day no buss cos some kid will bully him at nighta little high temp call the docnever say nowe may hurt his feelings final prdctantifa,age
but if you point finger at this idiot you shall be told not all pakis are like him religion of peace you are islamophobic he does not represent muslims,religion
mohammed led military expeditions beheaded jews in one day married a six year old girl etc etc get the picture,religion
« dont start with that im brown bullshit you are black you are a nigger you are filthy amp disgusting» oh,ethnicity
the bord mkr,not_cyberbullying
at this rate hell have cost the country almost million in year do the math idiot,other_cyberbullying
of muslims are killed by other muslims microbrain,religion
in a world where you can be anything be kind says the girl who probably bullied you in high school and made your life hell but now that the host of her favourite trashy reality show sadly killed herself suddenly gives a shit about mental health and kindness towards others,age
rt the part of the law and order episode that seems implausible is how theres an online threat to a woman and the police do …,other_cyberbullying
nan,other_cyberbullying
